Title,Paragraph,Image
Tesla Berlin Factory Resumes Production After Arson Attack,"Tesla's factory located near Berlin has started to resume operations following an arson attack that resulted in a week-long power outage. The factory was successfully reconnected to the power grid late on Monday, thereby restoring power and enabling production to begin once again. The Volcano Group, described as a far-left activist organization, has taken credit for the attack on an electricity pylon that disrupted the power supply to the plant the previous Tuesday. The timeline for full production recovery remains uncertain, with the shutdown initially anticipated to last until the end of the week, potentially incurring significant costs for Tesla. Situated 30 kilometers southeast of the German capital, this factory is Tesla's sole European facility, capable of manufacturing up to 375,000 electric vehicles annually, primarily the Model Y cars priced at approximately $49,196. A week's worth of halted output could amount to roughly $354 million in sales for Tesla. Analysts have warned that an extended shutdown of around 10 days or more may impact Tesla's first-quarter financial results. However, the company could potentially make up for lost production in the following weeks, especially considering the current tepid demand for electric vehicles in Europe, potentially lessening the overall impact. The Volcano Group defended their actions by asserting that Tesla's factory depletes Earth's resources and exploits labor to produce 6,000 SUVs and monster trucks weekly. In response, Tesla CEO Elon Musk criticized the group, labeling them as either ""the most foolish ecoterrorists on the planet"" or pawns manipulated by individuals with malicious environmental motives. Musk contended that disrupting the production of electric vehicles rather than fossil fuel vehicles is misguided. Beyond the recent arson incident, Tesla has encountered other challenges in its Berlin operations. The company's proposal to increase the factory's production capacity to 1 million electric vehicles per year, potentially making it Europe's largest car plant, has faced opposition from local residents. Additionally, earlier this year, Tesla had to halt most production at the Berlin plant due to attacks on container ships in the Red Sea, leading to delays in component deliveries.",Tesla Berlin Factory Resumes Production After Arson Attack.jpg
"Tragic Death of Itai Chen, U.S.-Israeli Hostage Held by Hamas","The Israel Defense Forces have confirmed the tragic passing of Itai Chen, a dual U.S.-Israeli citizen held captive by Hamas since the attacks on October 7. These attacks, carried out by terrorists who infiltrated southern Israel, resulted in significant destruction. Chen, a sergeant stationed on the Gaza border, was seized on what is now known as Black Saturday in Israel. Authorities report that Hamas is still holding his remains. Chen, aged 19, was cherished as a popular figure always surrounded by friends. He was passionate about the outdoors, particularly hiking, and held a leadership role in youth organizations. He adored his family's pet dog, Gucci, and enjoyed basketball, good food, and music. Chen, the middle child among three siblings, had been in a loving relationship with Neta for over a year, whom he regarded as his soulmate.At present, 134 individuals are still detained in Gaza, with 34 confirmed deceased. President Biden extended his sympathies, expressing sorrow over the loss of American citizen Itai Chen at the hands of Hamas during the vicious attack on October 7. He recalled meeting Chen's father and brother at the White House in December, where they shared their grief and uncertainty. Chen's parents and an aunt were special guests at Biden's recent State of the Union address. Chen was serving in a tank unit when he was taken captive and is one of six U.S. citizens still held by Hamas. President Biden reiterated his dedication to tirelessly working for the release of all hostages.In a demonstration of support, a group marched through Central Park in New York City on March 10, 2024, demanding the freedom of the 134 individuals currently held in Gaza. President Biden reaffirmed Israel's right to pursue Hamas, condemning the group for using civilians as shields.","Tragic Death of Itai Chen, U.S.-Israeli Hostage Held by Hamas.jpg"
Felipe Massa Sues Bernie Ecclestone and FIA for 2008 F1 Title,"Former Ferrari driver Felipe Massa has taken legal action against Bernie Ecclestone, former head of Formula One, and the sports governing body, the FIA. Massa is seeking official recognition as the 2008 world champion and a payout of £64 million. This move stems from Massa's belief that he rightfully deserves the 2008 world champion title, a claim linked to the infamous ""Crashgate"" scandal. The scandal unfolded during the 2008 Singapore Grand Prix when fellow Brazilian driver Nelson Piquet Jr deliberately crashed his Renault into a wall to assist his teammate, Fernando Alonso, who went on to win the race. Piquet Jr later admitted that the crash was orchestrated by the team, leading to a major scandal that resulted in Renault not contesting race-fixing allegations and the departure of two senior team members.The deliberate crash caused a safety car to be deployed, during which Ferrari made a critical error during a pit stop, causing Massa to drop from first place to finishing 13th. This incident ultimately cost Massa the championship title by just one point to Lewis Hamilton. The scandal only came to light a year later, and despite penalties imposed on Renault, officials deemed that the results could not be altered due to the time that had passed.Massa, now 42, is being represented by Brazilian law firm Vieira Rezende Advogados and filed the lawsuit on Monday. He expressed his determination to pursue justice through the legal system to correct what he perceives as a historical injustice. Ecclestone, 93, who led Formula One for four decades until 2017, has voiced support for Massa's legal action and believes that an English judge should determine the truth of the matter.Lewis Hamilton, who won his first title in the controversial 2008 season, stated last September that Massa's decision to sue is his own, and he prefers not to dwell on the past. The £64 million sought by Massa represents the estimated financial losses he incurred by missing out on the championship, including differences in salary for the rest of his career, sponsorship opportunities, commercial deals, and a £1.7 million bonus he would have received from Ferrari.Both Formula One Management (FOM) and the International Automobile Federation based in Paris have declined to comment on the matter. Massa, who suffered a severe head injury at the 2009 Hungarian Grand Prix, did not win another race after 2008 and eventually retired from racing in 2017.",Felipe Massa Sues Bernie Ecclestone and FIA for 2008 F1 Title.jpg
Tragedy Strikes Iditarod_ Two Dogs Die in Grueling Race,"Over the past weekend, the annual Iditarod sled dog race in Alaska faced a tragic turn of events with the unfortunate deaths of two dogs, marking the first fatalities during the race in five years. These incidents have sparked renewed discussions about the continuance of the challenging 1,000-mile competition, where mushers and their dog teams navigate hazardous terrains and weather conditions. The first dog, a 2-year-old named Bog, was a member of musher Issac Teaford’s team. Bog collapsed just 200 feet shy of a checkpoint in the village of Nulato, situated 582 miles into the race. Despite efforts by a veterinarian to administer CPR for approximately 20 minutes, Bog did not survive. Another dog, George, a 4-year-old on musher Hunter Keefe’s team, also collapsed and passed away around 35 miles outside of the village of Kaltag, at 629 miles into the race. The exact cause of death for both dogs is still under investigation, with additional testing planned. In response to these tragic events, both Teaford and Keefe chose to voluntarily withdraw from the Iditarod Trail Sled Dog Race. The most recent dog fatality during the annual race occurred in 2019, involving a 5-year-old female named Oshi, who exhibited signs of pneumonia during a post-race examination. The loss of Bog and George has spurred animal rights group, People for the Ethical Treatment of Animals (PETA), to renew their call for an end to the race. PETA has long been a vocal critic of the Iditarod, highlighting the physical strain endured by the dogs. The organization asserts that over 150 dogs have perished since the race’s inception in 1973, though race officials have not released an official tally. In recent times, PETA has also targeted race sponsors, resulting in several companies, such as Alaska Airlines, ExxonMobil, Wells Fargo, and Chrysler, discontinuing their support of the event. The Iditarod, one of the most extensive sled dog races globally, is a demanding competition lasting around 10 days, traversing mountain ranges, frozen rivers, and sea ice. Despite the recent tragedies and ongoing criticisms, the race proceeds, and the anticipated winner is projected to cross the finish line in Nome by midweek.",Tragedy Strikes Iditarod_ Two Dogs Die in Grueling Race.jpg
England Faces Measles Surge_ Over 1 Million Unvaccinated Youngsters Targeted for Catch-Up Shots,"Following a notable rise in measles infections in England, more than 1 million young individuals who have not received the measles vaccination are being urged to get catch-up shots. This response comes after hundreds of cases were reported in the country in recent months, contrasting sharply with the situation five years ago when England had achieved 'elimination' status for the disease. The majority of cases have been documented in the West Midlands region and in London. Public health officials are reaching out to 900,000 adults aged 19 to 25 and 200,000 teenagers aged 16 to 19 to take advantage of the free vaccination offer. This initiative is part of a broader campaign where the National Health Service in England has already invited over a million children for catch-up vaccinations. While measles vaccinations are typically administered during infancy and early childhood, they are still deemed safe and effective for older children and adults. Individuals who may have missed even one dose during childhood are strongly advised to get vaccinated. Measles is a highly contagious disease caused by a virus that affects the respiratory tract and other parts of the body. It can lead to severe symptoms and potentially fatal outcomes. Serious complications such as deafness, blindness, and brain swelling can arise from measles. Pregnant women are at particular risk, as the disease can result in low birth weight, premature birth, and stillbirth. Health experts caution that measles outbreaks could escalate if vaccination rates do not improve. Vaccination provides robust protection against the disease, but vaccination coverage has been inconsistent over the years. To maintain low case numbers, it is crucial for 95% of the population to be vaccinated, a target that is presently not being met. Many of the young individuals being encouraged to get catch-up shots would have been eligible for vaccination in the late 1990s and early 2000s, a period when vaccination rates in England began to decline. This decline was partly influenced by fraudulent research that erroneously linked the mumps, measles, and rubella vaccine to autism. In recent times, the Covid-19 pandemic has disrupted routine childhood immunization schedules globally and has fueled a new wave of vaccine hesitancy.",England Faces Measles Surge_ Over 1 Million Unvaccinated Youngsters Targeted for Catch-Up Shots.jpg
Necture Secures $7M Series A Funding for Fleet Management and EV Transition,"Austria-based start-up Necture, a company specializing in car fleet management and charging infrastructure, has successfully secured additional funding to boost its Series A financing to over $7 million. The company, previously known as Ubiq, decided to rebrand following this recent injection of capital. The funding round was led by Smart Energy Innovationsfonds and Verbund X Ventures, along with support from existing investors Speedinvest and smartworks innovation GmbH. Necture’s innovative platform supports car sharing and rental fleets in their transition to electric vehicles by providing predictive analysis to operators, enabling a comprehensive overview of operations and charging statuses. This leads to enhanced fleet uptime and cost reductions, facilitating a seamless shift to electric vehicles.CEO Christian Adelsberger disclosed that Necture is actively collaborating with car sharing fleets in 20 cities across Europe, North America, and South America, overseeing 15,000 vehicles. The company is now aiming to venture into the corporate fleet sector, which presents distinct challenges. Adelsberger highlighted the lag in connectivity, data availability, and electric vehicle adoption within business fleets compared to car sharing fleets. He pointed out, “One of the challenges hindering us on the technological front is the current level of connectivity accessible in the mainstream market.”To address this issue, Necture is working closely with Original Equipment Manufacturers (OEMs) to gain direct access to their core systems and is also developing aftermarket technologies to establish vehicle connectivity. Adelsberger emphasized the importance of car manufacturers unlocking the value of the data collected from their vehicles through collaboration with third-party entities like Necture. Although Necture’s primary market is in Europe, the company is actively expanding its presence in the Americas. The Series A funding will be utilized to broaden the company’s offerings to corporate fleets and enhance its market penetration in both regions.Adelsberger concluded, “Merely providing a charging socket is insufficient. It is imperative to effectively manage operations, determining which vehicle should charge first, where, and when, especially when it needs to be ready for use by 9 am the following day.”",Necture Secures $7M Series A Funding for Fleet Management and EV Transition.jpg
Doriane Pin’s Exceptional Talent Shines in F1 Academy Opener Despite Controversy,"Doriane Pin, an up-and-coming talent in the realm of Formula 1 racing, received high praise as an ""exceptional talent"" from Jessica Hawkins, Aston Martin's driver ambassador. This commendation comes on the heels of Pin's remarkable showing at the F1 Academy season opener in Jeddah, where she claimed pole position for both races. Despite a controversial downgrade to ninth place in Race 2 stemming from a misunderstanding about the race's conclusion, Pin's prowess and resolve remained undisputed.As a Mercedes junior driver, Pin secured victory in Race 1 and held the lead in Race 2 until an unforeseen twist of events unfolded. Unaware that the race had concluded, Pin completed an extra lap at full throttle, triggering a red flag and subsequently earning a drive-through penalty. This penalty was later adjusted to a 20-second time penalty, resulting in her descent to ninth place. Consequently, Abbi Pulling of Britain ascended to first place, with Ferrari's Maya Weug and Nerea Marti trailing in second and third places, respectively.Despite the tumultuous turn of events, Hawkins, the most recent female driver to test an F1 car, lauded Pin's performance, noting that her dominance throughout the weekend was evident and that she undeniably possesses exceptional talent. Hawkins expressed optimism that Pin would rebound in the upcoming race.Established in 2023, the F1 Academy strives to facilitate a smooth progression from karting to the F1 feeder series, with the ultimate objective of witnessing a woman compete in F1. Hawkins, who also serves as Aston Martin's head of racing for the F1 Academy, conveyed her enthusiasm for the championship and underscored the significance of nurturing and motivating the younger generation of female drivers.The most recent woman to partake in an F1 weekend was Susie Wolff in 2014, while Lella Lombardi remains the sole woman to have earned points in a Grand Prix race back in 1975. The current ambition is to normalize the presence of women in Formula 1 rather than view it as a milestone, a vision that remains a work in progress but one that the F1 Academy actively strives to realize.",Doriane Pin’s Exceptional Talent Shines in F1 Academy Opener Despite Controversy.jpg
VAST Data Unveils Revolutionary AI Cloud Architecture with Nvidia’s BlueField-3 DPU,"VAST Data has introduced an innovative AI cloud architecture that leverages Nvidia’s BlueField-3 DPU technology to enhance performance, security, and efficiency in AI data services. This new approach aims to streamline data center operations and establish a secure, zero-trust environment by integrating storage and database processing directly into AI servers. The architecture utilizes Nvidia’s BlueField-3 DPU, a specialized processor that accelerates and isolates data center workloads to boost performance, enhance security, and improve data processing efficiency.By offloading networking, security, and storage tasks to the DPU, VAST Data can reduce the burden on the main CPU, allowing it to focus on AI and machine learning computations. The architecture creates a parallel system where storage and database processing services are integrated directly into AI servers, enabling true linear scalability of data services across numerous GPUs without the usual bottlenecks associated with traditional x86 hardware and networking layers. This setup enhances the efficiency of VAST Data’s network-attached Data Platform infrastructure, resulting in a 70% decrease in power consumption and data center footprint.The DPU's processing power also benefits GPU cloud providers in multi-tenant environments, thanks to VAST’s zero-trust security model, which ensures data isolation and secure data management. VAST Data’s innovative approach diverges from traditional designs by embedding its operating system directly into an AI cluster, maximizing the capabilities of Nvidia’s BlueField-3 DPUs to transform supercomputers into specialized AI data engines. This advancement is a significant stride in eliminating storage bottlenecks in AI and other performance-sensitive settings.VAST Data’s zero-trust security model plays a crucial role in a “cloud-first” environment where organizations rely on GPU cloud providers for model training. Collaborations with leading providers like Lambda, CoreWeave, and Core42 enable VAST Data to offer a robust security model enforced by its DPU-based architecture. The partnership between VAST Data and Nvidia represents a notable progression in optimizing data services for the unique requirements of AI. By utilizing DPUs to alleviate performance bottlenecks in the data path, VAST Data establishes itself as a key player in this competitive landscape.",VAST Data Unveils Revolutionary AI Cloud Architecture with Nvidia’s BlueField-3 DPU.jpg
"iPad Pro 11-Inch Model Faces Supply Constraints, OLED Display Transition Expected","The forthcoming iPad Pro, specifically the 11-inch variant, may initially encounter supply constraints as per a recent report from esteemed analyst Ross Young. Production for the smaller model is reportedly running behind schedule, potentially leading to limited availability upon its launch. One of the most highly anticipated features of the upcoming iPad Pro is the anticipated shift from an LCD screen with miniLED backlights to an OLED display. This transition would mean that both the 11-inch and 12.9-inch iPad Pro models will feature the same screen technology for the first time in years. Presently, only the larger 12.9-inch model offers the advanced miniLED backlighting, while the 11-inch model utilizes a standard LCD screen. Young has suggested that LG Display is preparing to start shipping the 11-inch OLED panels soon. Samsung is also reportedly in the production of panels for the 11-inch iPad, while LG Display is manufacturing screens for the larger iPad Pro. However, there seems to be a delay in producing the displays for the smaller model compared to the larger one. This potential setback might necessitate consumers to act promptly to secure the smaller tablet once the release date is confirmed. Although there have been speculations about the imminent unveiling of the new iPads, it is speculated that the announcement could happen around March 25, with the release date following shortly after Easter, on April 5. The new iPad Pro is anticipated to debut alongside refreshed iPad Airs, a new Magic Keyboard, and an enhanced Apple Pencil. The new hardware is expected to be launched towards the end of March or in April, aligning with the expected readiness of the accompanying iPadOS 17.4 software.","iPad Pro 11-Inch Model Faces Supply Constraints, OLED Display Transition Expected.jpg"
LATAM Airlines Boeing 787-9 Dreamliner Incident_ Black Boxes Seized by TAIC,"The Transport Accident Investigation Commission (TAIC) of New Zealand has taken possession of the flight data recorders from a LATAM Airlines Boeing 787-9 Dreamliner following a mid-flight mishap that resulted in at least 50 people sustaining injuries. The aircraft was en route from Sydney, Australia to Auckland, New Zealand when it encountered a sudden descent attributed to a technical malfunction, causing passengers to be jolted from their seats. The TAIC is presently collecting evidence, including data from the cockpit voice recorder and flight data recorders, to analyze the flight's course and the communication between the pilots during the event. Passengers onboard the flight recounted a harrowing ordeal, recounting instances of individuals being propelled out of their seats, colliding with the plane's ceiling, and being thrown along the aisles. Brian Jokat, a passenger, shared images illustrating the damage to the plane's ceiling caused by passengers hitting it. Additional images depicted passengers with bruises and wounds. Jokat also mentioned that some ceiling panels were damaged due to individuals being thrust upwards, resulting in bloodshed. Upon landing in Auckland, passengers were attended to by paramedics and a fleet of more than ten emergency vehicles. While most injuries were minor, 13 passengers required hospitalization. LATAM Airlines, headquartered in Chile, expressed remorse for the inconvenience and harm suffered by its passengers and emphasized its unwavering commitment to safety as a top priority in its operational protocols. The flight was originally planned to proceed to Santiago, Chile following the layover in Auckland. The airline is currently collaborating with authorities to assist in the investigation of the incident. It remains unclear whether the flight data recorders have been relinquished to the TAIC at this point.",LATAM Airlines Boeing 787-9 Dreamliner Incident_ Black Boxes Seized by TAIC.jpg
